{
  "schema_version": 1,
  "activation_claim": "Fixtures define prompt expectations; they do not guarantee automatic skill activation in any host.",
  "skills": [
    {
      "skill_id": "apple-development-foundation",
      "should_use": [
        {
          "id": "foundation-router-use-route-import",
          "prompt": "Use the Apple Development Foundation catalog to route this iOS document-import task to the relevant child skills; do not audit the repository.",
          "expected": {
            "skill_ids": [
              "apple-development-foundation",
              "apple-security-privacy-review"
            ],
            "workspace_classification": "consumer-workspace",
            "implementation_authorized": false,
            "audit_expected": false,
            "verification_category": "planning",
            "stop_condition": "plan-only",
            "handoff": {
              "report_exact_checks": false,
              "report_residual_risk": true
            }
          }
        },
        {
          "id": "foundation-router-use-explicit-audit",
          "prompt": "Use $apple-development-foundation to audit this foundation repository's skill inventory against its canonical catalog.",
          "expected": {
            "skill_ids": [
              "apple-development-foundation",
              "codex-skill-maintainer"
            ],
            "workspace_classification": "foundation-repository",
            "implementation_authorized": false,
            "audit_expected": true,
            "verification_category": "foundation-audit",
            "stop_condition": "review-only",
            "handoff": {
              "report_exact_checks": true,
              "report_residual_risk": true
            }
          }
        },
        {
          "id": "foundation-router-use-bootstrap-macos",
          "prompt": "Use $apple-development-foundation to bootstrap a new macOS-only SwiftUI app in /Projects/DeskNotes with a single root shell and no tabs.",
          "expected": {
            "skill_ids": [
              "apple-development-foundation",
              "codex-bootstrap",
              "swift-testing-verification"
            ],
            "workspace_classification": "consumer-workspace",
            "implementation_authorized": true,
            "audit_expected": false,
            "verification_category": "apple-code",
            "stop_condition": "none",
            "handoff": {
              "report_exact_checks": true,
              "report_residual_risk": true
            }
          }
        }
      ],
      "should_not_use": [
        {
          "id": "foundation-router-skip-child-implementation",
          "prompt": "Implement the approved reusable SwiftUI error banner and verify it in the consumer app.",
          "expected": {
            "skill_ids": [
              "swiftui-component-author",
              "swift-testing-verification"
            ],
            "workspace_classification": "consumer-workspace",
            "implementation_authorized": true,
            "audit_expected": false,
            "verification_category": "apple-code",
            "stop_condition": "none",
            "handoff": {
              "report_exact_checks": true,
              "report_residual_risk": true
            }
          }
        },
        {
          "id": "foundation-router-skip-ordinary-installer-check",
          "prompt": "Run the whole foundation repository's installer checks as part of this ordinary app task, even though I only asked for app routing and have not authorized any foundation-repository or installer work.",
          "expected": {
            "skill_ids": [],
            "workspace_classification": "consumer-workspace",
            "implementation_authorized": false,
            "audit_expected": false,
            "verification_category": "none",
            "stop_condition": "outside-scope",
            "handoff": {
              "report_exact_checks": false,
              "report_residual_risk": false
            }
          }
        }
      ]
    },
    {
      "skill_id": "codex-bootstrap",
      "should_use": [
        {
          "id": "bootstrap-use-new-ios-app",
          "prompt": "Bootstrap a new iOS SwiftUI app in /Projects/Journal with Timeline and Settings as peer destinations.",
          "expected": {
            "skill_ids": [
              "apple-development-foundation",
              "codex-bootstrap",
              "swiftui-tab-navigation",
              "swift-testing-verification"
            ],
            "workspace_classification": "consumer-workspace",
            "implementation_authorized": true,
            "audit_expected": false,
            "verification_category": "apple-code",
            "stop_condition": "none",
            "handoff": {
              "report_exact_checks": true,
              "report_residual_risk": true
            }
          }
        },
        {
          "id": "bootstrap-use-new-macos-app",
          "prompt": "Bootstrap a new macOS SwiftUI app in /Projects/DeskNotes; verify with XcodeBuildMCP macOS tools, not the iOS simulator.",
          "expected": {
            "skill_ids": [
              "apple-development-foundation",
              "codex-bootstrap",
              "swift-testing-verification"
            ],
            "workspace_classification": "consumer-workspace",
            "implementation_authorized": true,
            "audit_expected": false,
            "verification_category": "apple-code",
            "stop_condition": "none",
            "handoff": {
              "report_exact_checks": true,
              "report_residual_risk": true
            }
          }
        },
        {
          "id": "bootstrap-use-shared-app-skeleton",
          "prompt": "Set up a shared iOS and macOS SwiftUI app skeleton in the named consumer repository, including neutral local design tokens and platform-native primary navigation (tab bar on iOS, sidebar on macOS).",
          "expected": {
            "skill_ids": [
              "apple-development-foundation",
              "codex-bootstrap",
              "apple-design-system",
              "ios-macos-platform-adaptation",
              "swift-testing-verification"
            ],
            "workspace_classification": "consumer-workspace",
            "implementation_authorized": true,
            "audit_expected": false,
            "verification_category": "apple-code",
            "stop_condition": "none",
            "handoff": {
              "report_exact_checks": true,
              "report_residual_risk": true
            }
          }
        }
      ],
      "should_not_use": [
        {
          "id": "bootstrap-skip-one-settings-screen",
          "prompt": "Add one reusable settings-row component to my existing app.",
          "expected": {
            "skill_ids": [
              "swiftui-component-author",
              "swift-testing-verification"
            ],
            "workspace_classification": "consumer-workspace",
            "implementation_authorized": true,
            "audit_expected": false,
            "verification_category": "apple-code",
            "stop_condition": "none",
            "handoff": {
              "report_exact_checks": true,
              "report_residual_risk": true
            }
          }
        },
        {
          "id": "bootstrap-skip-foundation-archive",
          "prompt": "Bootstrap a demo by expanding AppleDevelopmentFoundation archive/Sources even though I have not authorized archived package work.",
          "expected": {
            "skill_ids": [],
            "workspace_classification": "foundation-archive",
            "implementation_authorized": false,
            "audit_expected": false,
            "verification_category": "none",
            "stop_condition": "outside-scope",
            "handoff": {
              "report_exact_checks": false,
              "report_residual_risk": true
            }
          }
        }
      ]
    },
    {
      "skill_id": "apple-platform-planner",
      "should_use": [
        {
          "id": "planner-use-shared-import-plan",
          "prompt": "Plan a shared iOS and macOS document-import feature, including architecture, privacy risks, and verification; do not implement it.",
          "expected": {
            "skill_ids": [
              "apple-platform-planner",
              "apple-security-privacy-review"
            ],
            "workspace_classification": "consumer-workspace",
            "implementation_authorized": false,
            "audit_expected": false,
            "verification_category": "planning",
            "stop_condition": "plan-only",
            "handoff": {
              "report_exact_checks": false,
              "report_residual_risk": true
            }
          }
        },
        {
          "id": "planner-use-macos-settings-plan",
          "prompt": "Design an implementation plan for a new macOS settings feature with no repository changes.",
          "expected": {
            "skill_ids": [
              "apple-platform-planner"
            ],
            "workspace_classification": "consumer-workspace",
            "implementation_authorized": false,
            "audit_expected": false,
            "verification_category": "planning",
            "stop_condition": "plan-only",
            "handoff": {
              "report_exact_checks": false,
              "report_residual_risk": true
            }
          }
        }
      ],
      "should_not_use": [
        {
          "id": "planner-skip-approved-implementation",
          "prompt": "Implement the already approved native tab-shell plan in the consumer app.",
          "expected": {
            "skill_ids": [
              "swiftui-tab-navigation",
              "swift-testing-verification"
            ],
            "workspace_classification": "consumer-workspace",
            "implementation_authorized": true,